[
  {
    "id": "syntax-001",
    "kind": "syntax",
    "spec_clause": "CLC-v1 §3",
    "clc_revision": "CLC-1.1",
    "conformance_class": "CLC-A",
    "request": {
      "id": "std/database-v1:query:SELECT"
    },
    "expect": {
      "verdict": "valid"
    },
    "derivation": "literal identifier"
  },
  {
    "id": "syntax-002",
    "kind": "syntax",
    "spec_clause": "CLC-v1 §3",
    "clc_revision": "CLC-1.1",
    "conformance_class": "CLC-A",
    "request": {
      "id": "std/database-v1:query:*"
    },
    "expect": {
      "verdict": "valid"
    },
    "derivation": "trailing wildcard"
  },
  {
    "id": "syntax-003",
    "kind": "syntax",
    "spec_clause": "CLC-v1 §3",
    "clc_revision": "CLC-1.1",
    "conformance_class": "CLC-A",
    "request": {
      "id": "*:query:SELECT"
    },
    "expect": {
      "verdict": "invalid",
      "reason": "unsupported_wildcard"
    },
    "derivation": "bare * illegal"
  },
  {
    "id": "syntax-004",
    "kind": "syntax",
    "spec_clause": "CLC-v1 §3",
    "clc_revision": "CLC-1.1",
    "conformance_class": "CLC-A",
    "request": {
      "id": "std/database-v1:query:SEL*"
    },
    "expect": {
      "verdict": "invalid",
      "reason": "unsupported_wildcard"
    },
    "derivation": "partial segment wildcard"
  },
  {
    "id": "syntax-005",
    "kind": "syntax",
    "spec_clause": "CLC-v1 §3",
    "clc_revision": "CLC-1.1",
    "conformance_class": "CLC-A",
    "request": {
      "id": "std/database-v1:query:{read,write}"
    },
    "expect": {
      "verdict": "invalid",
      "reason": "unsupported_wildcard"
    },
    "derivation": "alternation not v1"
  },
  {
    "id": "syntax-006",
    "kind": "syntax",
    "spec_clause": "CLC-v1 §3",
    "clc_revision": "CLC-1.1",
    "conformance_class": "CLC-A",
    "request": {
      "id": "std/database-v1:query:[a-z]"
    },
    "expect": {
      "verdict": "invalid",
      "reason": "unsupported_wildcard"
    },
    "derivation": "character class not v1"
  },
  {
    "id": "entail-001",
    "kind": "entail",
    "spec_clause": "CLC-v1 §6.1",
    "clc_revision": "CLC-1.1",
    "conformance_class": "CLC-A",
    "grant": {
      "id": "std/database-v1:query:SELECT"
    },
    "request": {
      "id": "std/database-v1:query:SELECT"
    },
    "expect": {
      "verdict": "allow"
    },
    "derivation": "literal match"
  },
  {
    "id": "entail-002",
    "kind": "entail",
    "spec_clause": "CLC-v1 §6.1",
    "clc_revision": "CLC-1.1",
    "conformance_class": "CLC-A",
    "grant": {
      "id": "std/database-v1:query:*"
    },
    "request": {
      "id": "std/database-v1:query:SELECT"
    },
    "expect": {
      "verdict": "allow"
    },
    "derivation": "trailing wildcard matches"
  },
  {
    "id": "entail-003",
    "kind": "entail",
    "spec_clause": "CLC-v1 §6.1",
    "clc_revision": "CLC-1.1",
    "conformance_class": "CLC-A",
    "grant": {
      "id": "std/database-v1:query:*"
    },
    "request": {
      "id": "std/database-v1:query:SELECT:deep"
    },
    "expect": {
      "verdict": "allow"
    },
    "derivation": "wildcard matches multi-segment"
  },
  {
    "id": "entail-004",
    "kind": "entail",
    "spec_clause": "CLC-v1 §6.1",
    "clc_revision": "CLC-1.1",
    "conformance_class": "CLC-A",
    "grant": {
      "id": "std/database-v1:query:*"
    },
    "request": {
      "id": "std/database-v1:admin:DDL"
    },
    "expect": {
      "verdict": "deny",
      "reason": "different_namespace"
    },
    "derivation": "action-class 'query' vs 'admin' under same scheme -> different namespace (scheme + class, §9.1 layer 3)"
  },
  {
    "id": "entail-005",
    "kind": "entail",
    "spec_clause": "CLC-v1 §6.1",
    "clc_revision": "CLC-1.1",
    "conformance_class": "CLC-A",
    "grant": {
      "id": "std/database-v1:query:*"
    },
    "request": {
      "id": "std/database-v1:query"
    },
    "expect": {
      "verdict": "deny",
      "reason": "wildcard_requires_trailing_segment"
    },
    "derivation": "no trailing segment to match"
  },
  {
    "id": "entail-006",
    "kind": "entail",
    "spec_clause": "CLC-v1 §6.1",
    "clc_revision": "CLC-1.1",
    "conformance_class": "CLC-A",
    "grant": {
      "id": "std/database-v1:query:SELECT"
    },
    "request": {
      "id": "std/database-v1:query:INSERT"
    },
    "expect": {
      "verdict": "deny",
      "reason": "literal_mismatch"
    },
    "derivation": "literal mismatch"
  },
  {
    "id": "params-001",
    "kind": "entail",
    "spec_clause": "CLC-v1 §6.2",
    "clc_revision": "CLC-1.1",
    "conformance_class": "CLC-A",
    "grant": {
      "id": "std/database-v1:query:SELECT",
      "params": {
        "limit": 100
      }
    },
    "request": {
      "id": "std/database-v1:query:SELECT",
      "params": {
        "limit": 50
      }
    },
    "expect": {
      "verdict": "allow"
    },
    "derivation": "50 <= 100"
  },
  {
    "id": "params-002",
    "kind": "entail",
    "spec_clause": "CLC-v1 §6.2",
    "clc_revision": "CLC-1.1",
    "conformance_class": "CLC-A",
    "grant": {
      "id": "std/database-v1:query:SELECT",
      "params": {
        "limit": 100
      }
    },
    "request": {
      "id": "std/database-v1:query:SELECT",
      "params": {
        "limit": 150
      }
    },
    "expect": {
      "verdict": "deny",
      "reason": "params_exceed_grant"
    },
    "derivation": "150 > 100"
  },
  {
    "id": "params-003",
    "kind": "entail",
    "spec_clause": "CLC-v1 §6.2",
    "clc_revision": "CLC-1.1",
    "conformance_class": "CLC-A",
    "grant": {
      "id": "std/database-v1:query:SELECT",
      "params": {
        "tables": [
          "a",
          "b"
        ]
      }
    },
    "request": {
      "id": "std/database-v1:query:SELECT",
      "params": {
        "tables": [
          "a"
        ]
      }
    },
    "expect": {
      "verdict": "allow"
    },
    "derivation": "subset of array"
  },
  {
    "id": "params-004",
    "kind": "entail",
    "spec_clause": "CLC-v1 §6.2",
    "clc_revision": "CLC-1.1",
    "conformance_class": "CLC-A",
    "grant": {
      "id": "std/database-v1:query:SELECT",
      "params": {
        "tables": [
          "a"
        ]
      }
    },
    "request": {
      "id": "std/database-v1:query:SELECT",
      "params": {
        "tables": [
          "a",
          "b"
        ]
      }
    },
    "expect": {
      "verdict": "deny",
      "reason": "not_in_enum"
    },
    "derivation": "b not a member of allowed set (enum)"
  },
  {
    "id": "params-005",
    "kind": "entail",
    "spec_clause": "CLC-v1 §6.2",
    "clc_revision": "CLC-1.1",
    "conformance_class": "CLC-A",
    "grant": {
      "id": "std/database-v1:query:SELECT",
      "params": {
        "columns": {
          "t": [
            "id"
          ]
        }
      }
    },
    "request": {
      "id": "std/database-v1:query:SELECT",
      "params": {
        "columns": {
          "t": [
            "id",
            "name"
          ]
        }
      }
    },
    "expect": {
      "verdict": "deny",
      "reason": "not_in_enum"
    },
    "derivation": "name not a member of allowed set (enum)"
  },
  {
    "id": "params-006",
    "kind": "entail",
    "spec_clause": "CLC-v1 §6.2",
    "clc_revision": "CLC-1.1",
    "conformance_class": "CLC-A",
    "grant": {
      "id": "std/database-v1:query:SELECT"
    },
    "request": {
      "id": "std/database-v1:query:SELECT",
      "params": {
        "limit": 50
      }
    },
    "expect": {
      "verdict": "allow"
    },
    "derivation": "grant unconstrained"
  },
  {
    "id": "params-007",
    "kind": "entail",
    "spec_clause": "CLC-v1 §6.2",
    "clc_revision": "CLC-1.1",
    "conformance_class": "CLC-A",
    "grant": {
      "id": "std/database-v1:query:SELECT",
      "params": {
        "tables": []
      }
    },
    "request": {
      "id": "std/database-v1:query:SELECT",
      "params": {
        "tables": [
          "a"
        ]
      }
    },
    "expect": {
      "verdict": "deny",
      "reason": "empty_bound_denies_class"
    },
    "derivation": "explicit empty bound denies the class"
  },
  {
    "id": "params-008",
    "kind": "entail",
    "spec_clause": "CLC-v1 §6.2",
    "clc_revision": "CLC-1.1",
    "conformance_class": "CLC-A",
    "grant": {
      "id": "std/database-v1:query:SELECT",
      "params": {
        "limit": 100
      }
    },
    "request": {
      "id": "std/database-v1:query:SELECT",
      "params": {
        "limit": null
      }
    },
    "expect": {
      "verdict": "deny",
      "reason": "invalid_params_null"
    },
    "derivation": "null invalid in v1"
  },
  {
    "id": "intersect-001",
    "kind": "intersect",
    "spec_clause": "CLC-v1 §7",
    "clc_revision": "CLC-1.1",
    "conformance_class": "CLC-A",
    "grant": {
      "id": "std/database-v1:query:SELECT",
      "params": {
        "tables": [
          "a",
          "b"
        ]
      }
    },
    "others": [
      {
        "id": "std/database-v1:query:SELECT",
        "params": {
          "tables": [
            "a"
          ]
        }
      }
    ],
    "expect": {
      "verdict": "allow",
      "result_params": {
        "tables": [
          "a"
        ]
      }
    },
    "derivation": "overlap"
  },
  {
    "id": "intersect-002",
    "kind": "intersect",
    "spec_clause": "CLC-v1 §7",
    "clc_revision": "CLC-1.1",
    "conformance_class": "CLC-A",
    "grant": {
      "id": "std/database-v1:query:SELECT",
      "params": {
        "tables": [
          "a"
        ]
      }
    },
    "others": [
      {
        "id": "std/database-v1:query:SELECT",
        "params": {
          "tables": []
        }
      }
    ],
    "expect": {
      "verdict": "deny",
      "reason": "empty_bound_denies_class"
    },
    "derivation": "deny-when-declared"
  },
  {
    "id": "intersect-003",
    "kind": "intersect",
    "spec_clause": "CLC-v1 §7",
    "clc_revision": "CLC-1.1",
    "conformance_class": "CLC-A",
    "grant": {